{
  "RateID": "USCA-FLEX-ALRT-0000",
  "SystemTime_UTC": "2026-03-19T10:11:11.2455221Z",
  "RateName": "Flex Alert Status",
  "RateType": "Flex Alert",
  "Sector": null,
  "API_Url": "https://wwwmobile.caiso.com/TodaysOutlookApi/api/EmergencyNotices/v2/ActiveFlexAlertEvents",
  "RatePlan_Url": null,
  "EndUse": null,
  "AltRateName1": null,
  "AltRateName2": null,
  "SignupCloseDate": null,
  "ValueInformation": [
    {
      "ValueName": "No Active Flex Alert",
      "DateStart": "2026-03-19",
      "DateEnd": "2026-03-19",
      "DayStart": "Thursday",
      "DayEnd": "Thursday",
      "TimeStart": "07:00:00",
      "TimeEnd": "07:59:59",
      "Value": 0,
      "Unit": "Event"
    },
    {
      "ValueName": "No Active Flex Alert",
      "DateStart": "2026-03-19",
      "DateEnd": "2026-03-19",
      "DayStart": "Thursday",
      "DayEnd": "Thursday",
      "TimeStart": "08:00:00",
      "TimeEnd": "08:59:59",
      "Value": 0,
      "Unit": "Event"
    },
    {
      "ValueName": "Active Flex Alert",
      "DateStart": "2026-03-19",
      "DateEnd": "2026-03-19",
      "DayStart": "Thursday",
      "DayEnd": "Thursday",
      "TimeStart": "09:00:00",
      "TimeEnd": "09:59:59",
      "Value": 1,
      "Unit": "Event"
    }
  ]
}
